Id,ProductId,UserId,ProfileName,HelpfulnessNumerator,HelpfulnessDenominator,Score,Time,Summary,Text,Sentiment,user_review_count,product_review_count,vader_score,vader_sentiment,bert_sentiment,emotion,sarcasm,comprehend_sentiment
440769,B000OIMVR8,A1YJMG0QJXZLD4,Rosemarie,1,1,5,1301443200,Everyone likes them,"I had a store and I sold candy bars, and this was a favorite of all my customers.  I had to buy two to three of these big boxes per week.<br />the chocolate on the outside is smooth and the soft middle was always soft and not hard and stale.  I never ever had a complaint about these.",positive,96,1,0.2723,positive,positive,neutral,normal,POSITIVE
30082,B000DZFMEQ,AEQ19RUQOQUYE,"SD ""GF girl""",0,0,5,1246147200,Pamela's GF bread mix,"Fabulous product, hearty and tasty.  Just what gluten free consumers are looking for in a bread, pizza and pie crust mix.  Very easy too!",positive,1,295,0.8803,positive,positive,joy,de,POSITIVE
153097,B00141WDXG,A3K2MB2DZ2LJCN,"J. LAI ""jenlai1345""",4,5,1,1322697600,has stinky chemicals,"I used to get these instore and found a cheaper deal on Amazon. I recently realize when you open the bag, there's a strong smell (like plastic or chemicals). I tried a little bit myself and the smell is just so strong that I can't bear it. I tossed everything everything away and would not buy this again.<br />It's made in China. You don't know what they put in the chicken strips to get them addicted or .... sick.<br />AVOID!",negative,5,202,0.8442,positive,positive,disgust,de,NEGATIVE
124924,B005BHIESC,A3T9QQRV0JXZZR,Karen Avery,1,3,2,1314576000,Didn't like,The tropical fruit in this drink just didn't work for me. I prefer the taste of Bom Dia Coconut Splash Mango. Maybe the Mango Vita Coco version is better .,negative,2,82,0.4404,positive,negative,neutral,de,NEGATIVE
7018,B004K30HO2,A2FKLXI1GG4Y9N,lacowgirl13,0,0,5,1316908800,Awesome Idea!!!,"I am a creature of habit, and when I purchased my Keurig, I tasted alot of the coffee brands and flavors made for my appliance.  However, I never found one that I said ""this could replace the coffee I am currently using"".  So when I discovered the disposable K-cups I was delighted.  The problem now was I did not purchase enough.  So now I am waiting on my second delivery.  Great service.",positive,1,198,0.6908,positive,positive,joy,de,MIXED
478426,B005SH5GVS,AGZO4PSNC053W,Anna H,1,1,5,1332892800,Honestly the best jam I've ever tasted,"I originally bought this because I was looking for a low-sugar, all-fruit spread option for the morning toast that didn't involve any artificial colors or sweeteners.  What I ended up finding was the best jam ever!  The apricot flavor is prominent, with large chunks of fruit and a nicely textured ""jelly"" surrounding it.  It's sweet without being cloying, and a little tangy.  It definitely satisfies a sweet tooth in a way that the no-sugar (read: asparteme sweetened) jams never could.  Please do note, however, that there is sweetener in the form of grape juice concentrate.  It is technically ""all-fruit"", but some of that fruit is sugary juice concentrate.  Overall, I am extremely happy with the purchase and plan on stocking up!",positive,1,1,0.9469,positive,positive,neutral,de,POSITIVE
358931,B003CIBPN8,A20QIVFCEDD8PN,scchris2,0,1,1,1308528000,Horrible tasting,I like the flavor of coconut water. I love the flavor of mango.<br />This tastes nothing like the combination of the two.<br />Can somebody please explain what 100% natural from concentrate means?,negative,5,456,0.8552,positive,positive,neutral,de,POSITIVE
461815,B001E0WF4Y,A25SAHFBY6AYAP,BROOKLYNITE,0,0,5,1327104000,Works Wonders!,This tea is great and I find that it works best when I take it in the evenng before bed.  I do not drink the tea on a regular basis maybe once every 3-4 months as a cleanse.,positive,5,1,0.8519,positive,positive,neutral,de,POSITIVE
462069,B002Q7U94W,ALL9XFM0Q1N4E,Monopoly J,0,0,5,1315440000,Great Unique Flavors!,I like freeze dried fruit a lot so I thought that I would give this brand a try. It did not disappoint. The unique flavors you get with this brand are some of the best I've found in a freeze dried snack.<br /><br />If you're a fan of freeze dried fruit then you owe it to your taste buds to give these a try.,positive,55,11,0.897,positive,positive,neutral,de,POSITIVE
206857,B000BBY7ZC,ACXCS6NRA4EVU,Seattle girl,33,34,5,1179964800,Fabulous Flowers!,"I have ordered these flowers several times, and never been disappointed.<br /><br />They arrive in perfect condiiton and have gotten nothing but compliments from the recipients!",positive,5,54,-0.2093,negative,positive,surprise,de,POSITIVE
215259,B000Z4TDXQ,A3FY3H6F4249E0,Kathy W,4,5,5,1264636800,MMMM-mmmmm-gooooood!,"This is really yummy, and a great combo of tea and apple cider.  Bigelow is one of the better teas (You are talking to a huge tea-drinker here.)  The apple-cider taste is strong enough that you really enjoy it.  You can also really taste cloves and spice.  This tea and a piece of (my) home-made pumpkin pie, on a cold, damp Baltimore night--mmmmmmmmm--to die for!<br /><br />Ingredients (in this order): apple, hibiscus, cinnamon, natural apple flavor with other natural flavors (soy lecithin), orange peel, lemon peel, rose hips, licorice root, clove, natural apple cider flavor with other natural flavors (soy lecithin).<br /><br />No caffeine.  You really don't need sugar, unless you just want it sweeter.<br /><br />I suggest 2 bags per 24 oz hot water.",positive,127,16,0.9771,positive,positive,joy,normal,POSITIVE
308557,B000G7YO2M,A8IMWE5BZ2HDV,"Gerre S. Deibert ""writer-to-be""",5,7,2,1190592000,Could be better.,"The nuts are too hard for my teeth.  Also, delivery was made by UPS, which must have put the items on their truck in the morning but didn't deliver until 7 o'clock that evening.  By then, in the Florida heat, the chocolate coating had melted and stuck to the wrappers.  Would not order by mail again.",negative,5,54,-0.5187,negative,negative,sadness,de,NEGATIVE
235537,B003CK0XC0,A2M7DW0LS7WJL7,12345,1,2,5,1278288000,Favorite tea,I used Amazon because it was less expensive than buying at store on sale.  Also sometimes it is hard to find the Lemon Ginger tea.,positive,18,170,0.0772,positive,negative,neutral,de,POSITIVE
236177,B004NJIISK,A30Z5V1AWVZ9G7,Gecko Echo,0,0,5,1326412800,Creates Juciey Champange,"I have been very pleased with the product.  At first I was discouraged at 48 hours because the juice had very little carbonation and almost no noticeable alcohol.  However, after 4 days it produced a fizzy, tasty, alcoholic drink.  Now that I understand how to use the product I would say I can definitely recommend it.",positive,1,2,0.584,positive,positive,joy,normal,POSITIVE
386360,B00073JVFU,AZ4QFFUT8QVTA,Nelly Gonzalez,1,1,5,1239321600,Relaxing,This tea works for me.  It calms down my anciety and makes me sleep better.  It may not work for everyone.  Thank you!,positive,26,171,0.7901,positive,negative,joy,de,POSITIVE
13671,B000XXVI5U,A1KE9IKAE8LWWX,"TISH ""TISH""",0,0,5,1340582400,beautiful bonsai tree,I order the plum bonsai tree and it was packed good the tree came happy and is growing beautiful I'm very satisfied I will buy more bonsai trees from this company.,positive,1,4,0.9359,positive,positive,joy,de,POSITIVE
170436,B0000GK086,A1CP5CAA470KHO,Jossie A Picard,0,0,1,1324425600,Pure trash,"This order was pure trash. The assorted ""Mexican Candies"" were in a small ziplock bag. These had been bagged so long, and were so old, that they had ""bled"" through their wrappers, and all the products in the bag were coated with a sticky residue. I gave up and threw both bags away. Amazon should be ashamed of offering such a product!",negative,1,2,-0.4003,negative,negative,disgust,de,NEGATIVE
462288,B006N3I7JO,A10FJGRMOTJ35Y,"WJS ""W""",0,0,3,1301011200,JUST OK,"I don't like strong coffee so this wasn't my favorite.  If you like a bold coffee, you will like this one. My son likes it & recommended it to me.  I sent them to him.",neutral,8,66,0.6004,positive,positive,neutral,normal,POSITIVE
268805,B004SRFYMK,A37WNO14U908ZX,Lion,0,0,4,1306368000,Great Chocolate Drink,"I like plain Zico for hydration on a hot day, but this is more like dessert.  I think Chocolate Zico is better than Yoohoo.  The Zico tastes more natural and rich.  Be sure to shake it well and drink it cold.",positive,8,456,0.9713,positive,positive,fear,normal,POSITIVE
210608,B000CQG8M6,A41GHCYXE5ULP,Raven,0,0,5,1308614400,My favorite tea!,When you add cream to this tea as far as I'm concerned it beats any kind or flavor of coffee you can ever find. It makes an excellent after dinner drink or anytime of the day drink and is much more soothing with less caffeine than coffee.,positive,6,119,0.8655,positive,positive,neutral,normal,POSITIVE
305659,B001ELL4E0,A2U2BGL5Z45PQL,Barry D. Taylor,0,0,5,1276560000,Delicious and convenient,"My wife and I just love these oats.  They take a while to cook, unless you soak them overnight.  But the best part is you can cook up a big batch, refrigerate, and microwave in the morning for a quick breakfast.  They are almost as good microwaved as freshly cooked!  Rolled oats get clumpy and gross after they've sat for a while...not these.",positive,1,40,0.8391,positive,positive,disgust,de,POSITIVE
116192,B003OZX2H6,A1R391Q6632XEH,cheryl,1,1,5,1282953600,Black raspberry Sparkling Ice Water,This is a great product that we used to get at Sam's club. My husband likes it so well I am now ordering it on-line. Much better than most flavored waters,positive,2,15,0.9041,positive,positive,neutral,de,POSITIVE
501070,B000YVGMZW,A3UY6HZBM3NOT6,"David Wess ""I have listened to over 500 books...",5,5,5,1259366400,"Genova Tuna - excellent product, free shipping seals the deal","If you like tuna in oil, you will enjoy this product. Excellent taste, appearance and texture. Keep in mind that not all 'tuna in oil' is in olive oil - this one is. It is sooooo good that many folks will not need to add mayonnaise, thereby saving calories. Free Prime shipping was enough to seal the deal, as this item is heavy. Shipping from Peapod would have cost almost as much as the tuna. Delivered Amazon cost was only about $1.00 per can. We supply lunch to our employess - even if each person eats two cans, this is a bargain compared to the local deli, which charges around $7.00 for a sandwich. All considered, this is a winner and we have reordered several times.",positive,1,65,0.9628,positive,positive,neutral,normal,POSITIVE
50983,B00139C3P2,A115HRES7RTR5B,a customer,0,0,4,1339632000,Almost a 5,"I love the can size. I can use one per day rather than covering and refrigerating for the next day.  It is great because this food is supposed to go to the cat at room temperature.  Unfortunately,  I believe I checked when I was considering changing to these smaller cans and found that they are more expensive for the amount my cat eats per day than the larger cans.  The only reason I don't give this product a 5 can be remedied by either Newman's Own or Amazon.  I am a prime member but since subscribe and save does not use prime I have to double order.  There are 24 cans so prime once a month (regular shipping time vs. 2 day prime makes it longer than once a month) won't keep my cat feed for the month.  I don't understand why subscribe and save does not honor prime membership.  When customers choose subscribe and save they are giving Amazon long-term consistent business. I guess if Newman's Own packed 40 or 48 cans it would work better with subscribe and save.",positive,11,107,0.981,positive,positive,neutral,de,MIXED
457541,B001CWX7EG,A1482V19UP7PP9,J. Holland,1,1,5,1173312000,AL,"We find these pretzels better than the ""real"" ones. I order them by the case!",positive,6,147,0.4926,positive,negative,neutral,de,POSITIVE
250037,B0029NII3C,A20OQMLRFNZADL,Jazzer,1,1,4,1329091200,White meat chicken with dark bits,"This product is made in Thailand with what appears to be really nice white meat chicken and some sort of dark bits.  The dark bits I guess are made out of chicken, but appear to be manufactured - like hot dogs - you know fillers and dyes.  Plenty of juice and chewy looking.  I purchased the cheaper pouches - Choice Cuts -, but those do not compare in quality to this one.",positive,53,99,0.3604,positive,negative,disgust,normal,MIXED
245932,B001O023FK,A19H6L333W6IZW,nawlinsmom,1,1,5,1228521600,Tried most varieties - this is the best!,"This is absolutely the best chai tea I have ever brewed, and I've tried well over 20 different blends from many different tea purveyors! The spices are very rich and mixed with a nice blend of green and black tea for a wonderful robust yet clean taste. I typically prefer the bolder flavor of black tea, but have found most black chai teas too bitter to drink without some sweetener. This blend is delicious as is without any sweetener, hot or cold. My search for the perfect chai tea has ended -  thanks for a wonderful product!",positive,10,101,0.9847,positive,positive,joy,normal,POSITIVE
351724,B00423P420,A1QGO0Z8EDDIHQ,"R. Peterson ""richie""",0,0,5,1308960000,100% Turkey!,"These treats are a bit on the expensive side but worth it.  My dog absolutely loves them!  She gets so excited when she sees the bag, like no other treats I've tried. She sits and lays down randomly when I hold the bag, hoping she will get a reward.",positive,1,4,0.9736,positive,positive,joy,de,POSITIVE
440522,B001E52YO0,A33MKCQUCCZJW2,bearclawthedonut,1,1,2,1322524800,Were Great!  Now??????,"I've been offering Nathan's Hot Dog Treats to my English Springer Spaniel, Sadie, for two years.  All have been ordered from Amazon.  Up until the last batch ordered, a couple of months ago, they were GREAT!  They smelled delicious, a fresh summer sausage aroma.  Although I have never tasted this product, Sadie certainly very much loves them.  However, this last batch had a distinctly different aroma.  It was no longer a fresh beef sausage aroma, it is now an indistinct slightly smoked aroma. It did not smell fresh.  All four individual packages had this appreciably less inviting (to me) aroma.  There was no apparent mold on the product or in the bag.  As always, I kept these treats in the refrigerator both prior to and after they were opened.  Each package had, as alway, a desicant inside it.  Something has changed in their manufacturing and/or packaging?  Although, Sadie still ate them, it was obviously without the prior gusto.  These Nathan's treats are rather expensive; I can go to Walmart and purchase four treat packages, totaling one pound, for less than $5.00 that Sadie will enjoy every bit as much as these present Nathan's treats.  Sadie enjoys all treats given with a few loving words.  The words are free.  Nathan's - you have lost a customer.",negative,1,61,0.9852,positive,positive,neutral,normal,MIXED
397554,B001EYUE5M,A7WEL3CY60015,"Carol Nawrocki ""foodie""",0,0,5,1344729600,Green mountain Breakfast Blend,I think this is a great mild blend and the price is reasonable for a k-cup. I drink it every morning.,positive,7,241,0.6249,positive,positive,neutral,de,POSITIVE
448804,B003SBPW24,A3AYL6QV0YA4U6,Yula Flournoy,0,0,5,1344384000,Kid thinks it's a treat!,"It's cheap, it's organic, and it's Clifford! I pack these in my son's lunch every day, and on the weekends he thinks he's getting a treat if he gets one. Clifford juice is great! I like the fact that it isn't too big. My son gets a (reusable) bottle of water every morning, and he does not drink sodas unless he steals some from my friends. I don't like him getting empty calories, and most juice is just that. This has some nutrients but isn't too large. He gets a little sweetness, but not too much. I have this on subscribe and save, so it's even cheaper.",positive,1,4,0.9159,positive,positive,neutral,de,POSITIVE
5598,B000G1X45G,A2L7E5YIICYVJJ,Bry-man,0,0,5,1315699200,Still the best coffee!,"We were looking for a smooth, rich, non-acidic, non-bitter coffee when we came upon Amazon's reviews for Yuban coffee.  Well, we've been buying Yuban Original Roast Ground Coffee from Amazon for about a year now, and folks, what can we say, it's still the best tasting coffee around.  Coupled with our marvelous Bunn coffee maker (also an Amazon purchase) which makes a fresh, hot pot of coffee in 3 minutes, it just doesn't get any better than this.<br />Keep checking back weekly to see what the going price is (it fluctuates up and down quite a bit) and when you can catch it at a great deal, buy some.  You won't be disappointed.",positive,2,33,0.9752,positive,negative,neutral,normal,POSITIVE
209835,B0000DJ89V,A10TGMHJU2I8HS,Pierce H. Thompson,3,4,1,1247011200,Not food if you want taste and texture in return for calories,"We received a flyer in the mail -- an assortment of foods, beef, pork, and these really awful stuffed sole with crab and scallops. Well, like a dummy, I bought the deal.<br />So, perhaps the truth on Omaha Steaks: The sole stuffed with scallops and crab is really a shread of sole stuffed with a paste which I am hesitant to describe. It is not good to eat.<br />When our package arrived, we selected two filets mignon, two sole stuffed with scallops and crab, and four potatoes au gratin. The potatoes were edible.<br />The beef tenderloin was too thin to grill, but we grilled it anyway. Awful. I have already commented on the sole.<br />Still angry 12 hours later (color me stupid does not sit well with me!) I re-read all the information Omaha Steaks had sent us -- and conformed my suspicion that no where do these people state the grade of beef they sell.<br />The quality of the sole stuffed with scallops and crab is perhaps compatable with a very cheap diner on the interstate -- ""Well, you are hungry. This is cheap. You thought it might be good/interesting"" OK/ We have all made those mistakes on a long road trip -- but to buy this kind of nasty food to serve at home  -- I don't think so.",negative,8,18,-0.9834,negative,negative,disgust,de,NEGATIVE
559247,B000E682EG,A292GTOHU1XZ5K,sarak,0,0,5,1283472000,Lemon Zinger,"As we do not have this item in our country, I keep buying it here in the states for the last few years. And that's says all!!!!",positive,1,14,0.0,neutral,positive,neutral,de,POSITIVE
520492,B007TJGZ18,A28M11QEGV36HJ,JHM,0,0,4,1313452800,WOW - Wake up!!,"WOW again!  This coffee is quite strong.  My husband and I drink our coffee black, and I usually drink 2-3 cups per day.  But this coffee is almost like drinking expresso. If you are looking for a dark, rich, very strong coffee, this one's for you.  Those who add sweetener and cream might also enjoy this wake up coffee.  Double Black.... perfect name.  However, I can only drink one cup a day of this brand.",positive,5,178,0.9823,positive,positive,surprise,normal,POSITIVE
57223,B00817GPWQ,A2TB6X6Q9LEHWM,"Beth L. Lawler ""blynnlawler""",0,0,5,1297123200,oooooooooo yummy,"I tried this after having tried many chocolate/raspberry blends. Oh my! this is my favorite, perfect blend of the two flavors in a warm comforting cup. My husband who loves the GM wild blueberry says this is his new favorite! Thank goodness you get 48 cups in the order!! : )",positive,7,172,0.9741,positive,positive,joy,normal,POSITIVE
356193,B0018RYBZ4,A2L85QGSXS3AGP,MyOtherShirtIsClean,0,0,5,1260748800,"Best Low Carb Anything, Ever!!!","Simply put, this low carb pasta has the taste and texture of real pasta.  It is so good, sometimes I wonder if it's truly low carb.",positive,1,18,0.4882,positive,positive,surprise,de,POSITIVE
518336,B001FCFYU8,A1E9I5NUTLM7XB,"Melanie Tye ""Amazon.com Junkie""",1,2,2,1163289600,Tastes like Cough Syrup,"I really wanted to like this tea because it is full of antioxidants. I was hoping for a fruity flavor, but instead it tastes just like cough syrup. I do not have good memories of cough syrup as a child, so because the flavor reminds me so much of yucky cough medicine, I can not drink it. I tried to drink it anyways, thinking that the benefits of a tea filled with anti-oxidants outweigh the flavor, but I just couldn't do it! Well, that is just my 2 cents. If anyone else has tried this and agrees with me, let me know!",negative,7,206,0.4196,positive,negative,neutral,de,NEGATIVE
267845,B000FKQDD8,A3ELDAVPZHG7GI,"Life drowner, not saver",0,0,1,1346716800,Mixed Lifesavor flavors with no return possible.,"Very disappointed, lastshiment (12 bags) of Wild Cherry Lifesavers had sour flavors mixed the wild cherry flavor. it was mixed throughout all 12 bags. My customers complained and when I went to Amazon to return, guess what no luck because they are considered a Grocery item. Had to take them all back and refund money. No avenue to get consideration from Amazon. I buy many products and this small item bothered me because no return eligible.",negative,1,18,-0.8973,negative,negative,sadness,normal,NEGATIVE
11901,B000SSXTAM,A2HCKBBEXELJ3R,Pampeliska,0,0,5,1342396800,"Only Discovered This Recently, Bronze Powder is Truly Lustrious and Beautiful.","I wish I had found this product sooner.<br />So far have only used it on my homemade chocolate truffles, and it does add a beautiful, almost mysterious bronze luster to them.  Almost hard to believe that it really IS edible.<br />Very happy with it and would definitely recommend.",positive,21,10,0.9402,positive,positive,joy,de,POSITIVE
130615,B005VTYOGQ,A1F7SX3GNVBNE3,"Joshua G. Feldman ""Technophile""",0,0,5,1327104000,Kentucky Spirit is Kentucky bourbon at a higher level,"Wild Turkey is good Kentucky bourbon whiskey and Kentucky Spirit is Wild Turkey's top of the line expression in regular production:  Master distiller Jimmy Russel's statement product.  It's a single barrel selection with the barrel and rick numbers on each neck label served up at 101 proof to keep most of the cask goodness intact.  I was expecting it to be good.  It exceeded my expectations.<br /><br />In the glass it's a dark coppery bronze color.  The nose is rich and complex and evolves strikingly through time.  Time is a big factor here.  This stuff is 101 proof and has a lot of alcohol to disperse.  Initially, the aroma of butter - as in brown butter and buttered corn is striking.  As it opens up, sweeter sherry, treacle, pecan pie, citrus and floral notes join in.  It's a positively delicious aroma.  First sip shows a toffee sweetness that explodes across the palate with apple flower, toffee frosting, maple candy, citrus spritz and vanilla oak.  It's a paradise of plant esters in a distilled spirit.  Finish is long and complex with unfolding layers of aged sawn wood, perfumed sweetness, bitter orange/dark chocolate fudgy notes and spicy spirit.  The glow in my mouth lingers for many long minutes, decaying into oak and toffee coffee bittersweet.  It's what bourbon is all about - yet it's quite rare at this price point.<br /><br />This is among the finest bourbons I've ever tried.  It's right up there with rare limited editions in sophistication and distinction.  Yet it treads a careful line through its disparate flavor elements, staying balanced among sweet and dry, floral and woody, bitter and sweet.  What a masterful performance.  I could drink it every day.  Comparable quality in Scotch whiskey or French Cognac would cost multiples of what you get for less than a U.S. Grant note here in the US.  Beyond the bargain aspect, the richness of flavor and complexity and balance of presentation shows that American distillery at the high end gives nothing up to the masters of the old world.  This is a first rate distillate - right up there with the world's best in refinement and sheer yumminess.  Jimmy Russel, I take my hat off to you.",positive,38,1,0.9927,positive,positive,sadness,normal,POSITIVE
325467,B0018CG2RY,A1N1QO3KXY41P9,Kirsten Stephenson,1,4,2,1156032000,Didn't work for my dog.....,"My dog ate nothing but this food for 3 months. I gave him the recommended amount and everything. Not only didn't he lose weight, he gained 6 pounds!!! Not worth the money or the trouble although he loved the way it tasted. Smells very strong because it has salmon in it.",negative,2,17,0.9437,positive,positive,disgust,de,MIXED
407824,B000NMGBR6,A117W36ZFIS2CU,KrysD,1,1,3,1340755200,LIFESAVERS SPEAROMINT,"Well, item arrived in good condition and in a reasonable amount of time but it is not as pictured. I was trying to buy what was pictured (the old Spear O Mint flavor.) I received the NEW AND IMPROVED Spear O mint flavor. It's definitely not improved. :(",neutral,1,2,0.9017,positive,negative,sadness,de,MIXED
306821,B000RI1W8E,A14HXQLEP9K78L,"rcdfrisco ""R.C.""",0,1,4,1275782400,Beware of Outrageous Shipping..,"Item not shipped by Amazon, but by a direct affiliated company...so when multiple items are ordered and Amazon quotes ""Free"" shipping...the direct / affiliated company does not have to honor the free shipping. I ordered 2 items which qualified for free shipping and was quoted and invoiced for free shipping. But when I received this $20. item, I was also charged $10 shipping/handling..  Everyone refused to honor the invoiced quoted price. I was given the option to return it ..for another $10...which now the shipping charges exceeded the cost of the item which if I returned, I no longer had...  Quite a reaming...!!!!",positive,5,193,0.9345,positive,negative,anger,de,NEGATIVE
259691,B005OTU3HC,A2Y37ZMR9ZJSDG,Samantha,0,0,5,1343088000,YUM!,"I've always eaten lots of microwave popcorn - it's a staple when I'm hanging out with my family!  Until recently I didn't realize how terrible it was for you.  I started looking for healthier alternatives and found Quinn at my local Whole Foods.  Not only is it so much better for you than the bright yellow, chemical-filled popcorn, but it is absolutely delicious!!  The flavoring is subtle but distinct.  And it's fun to put together!  I would highly recommend this snack to anyone!",positive,1,29,0.9666,positive,positive,fear,normal,POSITIVE
