Id,ProductId,UserId,ProfileName,HelpfulnessNumerator,HelpfulnessDenominator,Score,Time,Summary,Text,Sentiment,user_review_count,product_review_count,vader_score,vader_sentiment,bert_sentiment,emotion,sarcasm,comprehend_sentiment
324564,B000GB0UGC,A3N4CANP6C186O,"D. belcore ""www.fightbackwithyourfork.com""",58,60,4,1245456000,"Culinary teas bulk matcha vs. ""tea ceremony quality"" matcha","I am new to matcha drinking, so was somewhat concerned re: customer comments Culinary Teas matcha being ""brown"" (i.e. a not the correct bright green color). I had only tried Starbucks Matcha (PLEASE BE ADVISED - it is very tasty, but probably because the number one ingredient on the label is sugar). Also, a pound of Starbucks Matcha (as sold on a popular auction site) costs about the same as a pound of Culinary Teas bulk Matcha)...so you are getting far less of the expensive and healthful green tea powder and more sugar (the Starbucks product is somehow micronized so it does mix into solution much easier than a less processed pure tea powder). The teaspoon on the right is Teavana (at $16 for 30 grams - thats 2 Tbsp) they said it was the highest ""tea ceremony"" quality matcha. The teaspoon on the left is the bulk (1 lb, silver bag) CT product. Photo taken without a flash and not retouched so actual colors show. CT matcha  is slightly less brilliant green. I mixed exact quantities (1/2 tsp) of matcha in 8 oz of liquid with exact quantities of sweetener (a blend of xylitol and stevia that I am experimenting with). The CT matcha tastes slightly less ""green"" and slightly more bitter than the Teavana, but I did the math ( a pound of CT would cost $240 at the Teavana $16 per 30 g cost) - so I am very happy with my CT purchase. Will use the smaller container for my ""working"" supply, freeze the rest and use as needed. Am finding Matcha to be a great substitute for my ""too much coffee"" habit and prefer the less instantaneous (but prolonged) energy boost it gives - not too mention alkalizing instead of acidifying, ECGC, and possible metabolism boosting effect.<br />PS Most Starbucks barristas do not know the Matcha powder contains sugar, so they will tell you the are not adding any. As consumers, we need to ask companies to STOP ADDING SUGAR (in whatever processed form it takes) to everything they make.",positive,4,38,0.9858,positive,negative,neutral,de,MIXED
136589,B001O1VDXM,A3IV0GR96FM5ZO,"Jessica ""NobodysNothings""",5,5,5,1335312000,Perfect for my Purposes,"I bought this salt because i heard it was the secret ingredient for making a Tofu Scramble. Boy were they right! The slightly sulfurous taste/smell of this salt really made our scrambled Tofu taste just like eggs. It's in a powdered form, so it distributed evenly amongst the Tofu. I am very pleased with this product.",positive,2,9,0.7171,positive,positive,joy,normal,POSITIVE
234734,B000KV7ZGQ,AXJNAWQNYTJSX,Tracy L. Murray,0,0,5,1310342400,Perfect for my dogs!,I have had this toy for three months. My big dog loves plastic bottles and will assume every water bottle is meant for her so I was curious about how this toy would go over. It was a definite hit!  She loves it and ever after the beagle has tried to destroy it you can hardly see a mark on it!  At least as far as dogs are concerned I think this might be indestructible.,positive,3,556,0.8673,positive,positive,surprise,normal,POSITIVE
116759,B000FPKZTQ,A2CLPLB5VJJBTG,N. Price,0,0,5,1237593600,Max's favorite treat,"Looks pretty unappetizing if you ask me, but to my dog Max these treats are the cat's pajamas. He has separation anxiety, so I've tried a number of things to distract him with when I leave to make him happy and keep the peace. Dingo stix works the best by far, so I always have a good supply on hand.",positive,15,19,0.9754,positive,positive,sadness,de,POSITIVE
159407,B0006MU8QS,A1SF0RH7FHP7IO,J. Cruz,2,2,5,1202515200,Great product!,"My 2 mastiffs and a shepherd love these...it took them about an hour to remove the marrow and strip the jerky off the bone, but even after the good stuff is gone, they love to chew on the bones.  Nice smokey, bbq smell. Not too messy. If you can find them for an average of $3 per bone, that's a good  deal. I was lucky and had free shipping on my order. I've already reordered another case!!!",positive,4,9,0.9867,positive,positive,joy,normal,POSITIVE
465116,B0028AF5D2,A1OFNPJKUYOWY7,LadyMMO,1,3,1,1314662400,oil all over the box,"It arrived with the bottom of the box soaked in oil and the plastic bag was swimming in oil and peanut butter. I consider this unsafe to eat since it was obviously not sealed properly. There is a no return policy so I am just out almost 20 dollars. I could not return it in the same box since it has oil all over it, if they did allow returns.",negative,2,7,-0.0772,negative,negative,disgust,de,NEGATIVE
229508,B000EDG5CA,APE4KJ5LB5GA5,Tgomes176,6,6,5,1280448000,I love it,"This stuff is great. Simple, gets the job done, no excess unnecessary crap. I usually mix it with milk and frozen strawberries and it tastes like perfection. Haven't tried it by itself or with water though, but i would imagine it was good with milk and gross with water.",positive,1,34,0.4497,positive,positive,disgust,de,POSITIVE
382551,B000IYYRZW,AWU43J3C6KK5Q,E. Cody,0,0,5,1323561600,Enchanted drink,"I used to buy this from Sam's in a larger container, but purchased it from Amazon since they no longer carry it.  I have tins of this at home and tins at work, so I am prepared for my daily hot drink.  Really like this spiced drink.",positive,1,28,0.6893,positive,positive,joy,normal,POSITIVE
534997,B005PXZ6JM,A30YV0R9SLO4IR,Kim J.,0,0,5,1348876800,My favorite bags,"Tried Lanisoh and Simplese, these were my favorite ones.  Seemed to leak less frequently and I like that they are biodegradable.  Thinner softer material than the other brands but seemed more durable and stronger.",positive,1,158,0.7046,positive,negative,joy,normal,POSITIVE
244628,B0018CJNZ2,A1TKK55BZ2T8Y2,E. Leroy,5,8,1,1299542400,Mashed potatoes for your cat?,"Be sure to note that the reason they can call this 'grain free' is because they use potato and pea starch instead. (Just read the ingredients.)<br /><br />I ordered some without realizing this--when you open the bag you will be knocked off your feet by the smell of instant mashed potatoes.<br /><br />If your goal is to get your cat off starches, this isn't the one.",negative,4,14,0.6808,positive,negative,disgust,de,NEGATIVE
152356,B000LKZD4W,AXQIHSF9KK7CO,Dody,1,1,5,1213142400,Vegetarian Staple,"This product is a must have because it is a way for vegetarians to be able to have protein while on the go, and also for anyone whose physician has recommended additional protein intake, especially throughout the day.  The convenience is great and the flavor of this product is super.  I really enjoy it.",positive,39,127,0.923,positive,positive,joy,normal,POSITIVE
145659,B003D4F1QS,A1UELVIHHBUDUO,Kimberly Davies,0,0,5,1327276800,Delicious!,This tea is like having a slice of pumpkin pie without the guilt or calories ... it *smells* heavenly and is such a delight!  We will definitely be re-ordering this tea when we run out.,positive,4,409,0.9349,positive,positive,joy,de,POSITIVE
470812,B001ELL60W,A1MOS3J4MXX1U4,"GTK ""GTK""",0,0,4,1296864000,Good waffle mix!,"This is good stuff.  The directions on the can call for one egg plus mix and H2O.  The result is the perfect amount for making two waffles with a Waring Pro Belgian waffle maker.  Thanks to another reviewer for the suggestion of freezing the extra waffle for later use, much better than saving the extra mix. The waffles still need something more, so far I have added pecans and syrup, and pecans and Brown Cow maple yogurt.  The yogurt is far easier and more economical for me than whipping cream.",positive,16,277,0.93,positive,positive,neutral,de,POSITIVE
134909,B004HOQE64,A1G60ANYI0HMEU,Jeddy 3,0,0,4,1319241600,Not as crunchy as the other Blue Diamond flavors,"I'm addicted to Blue Diamond almonds. I've tried all the flavors -- and this was the last one I tried. I love salt, I love vinegar, and I love salt-and-vinegar potato chips, so how could I lose with these?<br /><br />Well, I'm just not that into them. The flavor's great and the almonds are fresh, but somehow the texture just fails. The almonds just seem... soggy. They don't have that wonderful crunch that the other Blue Diamond flavors have. And that flattens out the whole experience of eating them. I've eaten about 10 bags so far, and they all have the same lackluster texture.<br /><br />Oh well. Guess even my ol' reliable Blue Diamond can't hit it out of the park every time.",positive,57,171,0.8898,positive,negative,sadness,de,MIXED
239115,B0083QJUL8,A1DRXX5V1R0P5I,"Heidi R. Bristol ""HeidiStarDog""",0,1,5,1261785600,Grew up next to the farm,Love this syrup. As a born and breed Vermonter nothing is better than pure syrup! Now that I live in Florida I have it shipped to me here. LO-O-V-E it!!!,positive,1,53,0.6075,positive,positive,joy,de,POSITIVE
121411,B000V6DW5I,A3V73SENAP25W,D. Kellogg,0,0,5,1340928000,Amazing,"Both my wife and I eat this soup. It's not anything close to real chicken tortilla soup, but it's a great substitute. To answer one of the other reviews, yes the microwaveable version is a little less than filling. So I suggest the can, which has more chicken, rice, beans, and corn. The broth on its own is tasty. I don't realiize the salty taste as some, but I like flavor added to my soup. The chicken is much better in this than other brands, it's not any weird color or tiny. There is large white chicken meat in the soup. I usually break mine up a little just to have a more chicken ratio to soup.  The can by the way is done in just about the same amount of time on the stove top as the microwaveable version.<br />Suggestion, sprinkle a colby jack or ""fiesta"" blend of cheese after it comes off the stove and toss on some of those tortilla strips in the salad aisle, and you have yourself an amazing bowl of soup!<br />By the way, I've never seen carrots in this soup, not sure what soup the other reviewer was eating. No true Hispanic puts carrots in their tortilla soup, ew.",positive,1,7,0.9787,positive,positive,neutral,normal,POSITIVE
34487,B008FHUDW0,A2UKWK12MEF1RE,Mr. Fabio,1,1,5,1341446400,Unique blend love the taste,"I like the taste of Caribou coffees. I also had the Mahogany as well and like both flavors. The price on amazon beats the brick and mortar stores and free shipping saves me fuel, a win win for price and more so flavor.",positive,9,127,0.9565,positive,positive,joy,de,POSITIVE
375347,B000M9O604,A2YI0UR7F54SW4,Deepak Gupta,1,1,5,1222732800,An Indian delight!,"For all those Indians who are staying away from home and miss the food their mom's cook, this dish can bring a smile to your face. Spicy and delicious. One of the better MTR dishes out there.",positive,1,4,0.8176,positive,positive,joy,de,POSITIVE
365315,B001SITWC0,A2F0PWY9DM74V4,Anonymous reviewer,0,0,5,1303516800,Delicious!!,Jack Links are always a huge hit wherever we go.  Excellent to take on the airplane and on vacation for a quick snack!,positive,17,105,0.7424,positive,positive,joy,de,POSITIVE
502880,B001BCXAIA,A3P0YVL8HECR89,"Mary E. Arnold ""maryelise""",0,0,4,1348790400,Not my favorite...,"Not as tasty as traditional Rosarita beans but, duh, these are fat-free so I'm not surprised. (I decided to try these because they're half the price.) I also noticed I have more gas when I eat these. (Sorry for being so candid, but someone might find this helpful.) I don't notice a problem with regular beans. I do like Rosarita overall because of the great texture, but I won't buy fat-free again.",positive,3,5,0.9362,positive,negative,surprise,de,MIXED
178247,B00073IVAQ,A334MQCA8RFELB,Da Calico Cat,0,0,5,1319328000,Yummy tea,"I love this tea.. It was recomended to me by my Dr. to help during pregnancy.. Doesn't taste too bad with some honey, and makes me feel more relaxed.",positive,25,171,0.9223,positive,positive,joy,normal,POSITIVE
290826,B005HG9ESG,#oc-R1QHGBT11WAS7G,Mike Wallace,0,0,5,1346371200,Smooth and refreshing,"I love water and this water tastes great and is extra smooth. It is supposed to have a pH of 9.5 which makes it more alkaline which is much easier on our bodies and systems. I am a huge fan of alkaline foods such as salads and green juices, you can even get rid of indigestion by drinking some dissolved bicarbonate of soda in water. So, it is not surprising that this water actually has a small bit of bicarbonate of soda in the ingredients. This water has no after taste and is smooth and refreshing. It may be even better for hydrating because of the 9.5 pH. I would purchase this product in the future.",positive,3,387,0.9391,positive,positive,joy,de,POSITIVE
130331,B001KVPBS4,A1G60ANYI0HMEU,Jeddy 3,0,0,5,1319846400,The best almond flavor out there. How could something so delish be so good for you?,"The ""Jalapeno Smokehouse"" flavor is the best flavor in the Blue Diamond ""BOLD"" series, hands down. Unlike some of the other flavors, this one really tastes like what it's supposed to taste like -- that is to say, smoky jalapeno peppers. To my jaded taste buds, the pepper spice is fairly mild, but I imagine most people find it packs quite a kick. It's a good thing these huge, perfectly roasted nuts are great for you, because I eat them constantly. Hey, my HDL cholesterol (the ""good"" cholesterol) has actually risen as I've gotten older. I like to think it's partly because of these luscious babies. Dr Jeddy prescribes a handful every day!",positive,57,171,0.9849,positive,positive,neutral,de,POSITIVE
275515,B005VOONI0,APVK8GGSSUDCE,"Mitchell M. Tse ""mitchelltse""",0,0,2,1335312000,Pretty weak flavor,"I don't know what makes Organic coffee different from regular coffee, and in this instance, I honestly don't care.  I'm used to Starbucks coffee, as well as the occasional Pete's coffee, as well had coffee in France, Belgium, Italy, and the Netherlands.  On a scale of 1 to 10, 10 being strongest coffee, this Marley brand coffee is like a 2.  Weaker than the old-style McDonald's coffee (before McCafe's came about).  Weaker than instant coffee.<br /><br />I'm sure there are other flavors and nuances to this coffee, but I honestly can't get past the weak flavor.  Perhaps, if you like weak coffee, this may be for you, and maybe the organic process leaches stuff out, but for me, this one's not to my taste.<br /><br />At least the flavor's not bitter.",negative,33,288,0.6467,positive,negative,neutral,de,MIXED
141972,B003GTR8IO,A1RG4WKNMPYS4X,airfirehorse,0,0,4,1290470400,Pretty good,"There is a distinct vanilla flavor in this coffee for sure. It's strong in taste like a lot of Starbucks blends, plus I love the smell (my cat is afraid of the smell for some reason -- actually runs away from the open bag and he's generally a sniffer).<br /><br />Ingredient list on the bag:<br />ground coffee<br />natural flavor (w/ corn maltodextrin, vegetable glycerin)<br />ground vanilla beans<br />Indian sarsaparilla root<br /><br />The bag also says that it's 100% responsibly grown and ethically traded, but I don't see the actual words ""fair trade"" on it so I'm not sure what that means.<br /><br />Would I buy it at $13 for 22 ounces (2 11oz bags)? Probably not, but I'm cheap; I don't even go to their stores. But I think Starbucks fans will think it's worth it.",positive,12,530,0.8542,positive,positive,neutral,de,MIXED
524808,B0005YN6VG,A10ZK1IH0PDGJU,Dragoneer,0,0,5,1346457600,Have always loved this drink,"I ran into one six pack of Canfield's diet fudge in the local market and grabbed it; hadn't seen a can for years since it is no longer carried in my town. The market had no idea how it got on their shelf but the computer checkout system was able to generate a price. Yum! And nostalgia. Market had no way to order more so I checked Amazon and they had it. Not only that, it was less than three dollars per six pack and that included shipping. I am now the proud owner of sixteen six packs but the supply is diminishing rapidly.<br /><br />I chill the cans in the refrigerator and pour in a glass to drink. I put some heavy whipping cream (not yet whipped) in the glass first. It takes the fudge drink from superb to stellar. Of course it plays havoc with the idea of diet.<br /><br />I hope you all order this product and lots of it. We need to convince Canfield's to get six packs back on the shelves of local stores so we can grab some whenever we need to. The price is higher than when I bought it so I'm going to have to pace myself. I can only hope that my re-acquired addiction doesn't drive me to the poor house.",positive,13,37,0.8942,positive,negative,surprise,de,POSITIVE
132777,B000HG84EQ,A2XHKM8DU86QRB,Sunshine Crawford,1,1,1,1339977600,Bad Batch?,"I had high hopes for these fruit leathers as my daughter loves them.  When we received them in the mail and I opened the box they were all a very brown color, they look nothing like the red color in the picture shown.  Before giving my daughter one I wanted to try it myself to make sure they were ok.  I took one bite and spit it out.  It was very dry and did not taste like fruit at all.  It was awful.  From all of the outstanding reviews I am hoping we just got a bad batch but am not going to order another batch to find out.  I went back to Target and got the Archer Farms fruit strips.",negative,2,66,0.5632,positive,negative,disgust,normal,NEGATIVE
137642,B000CQE3HS,A2GALG7DHLK4F6,Mohan,0,0,5,1243468800,Spicy and tasty!,"I received my box of Slim Jim Giant, Tabasco flavored snacks a few weeks ago, and have been working my way through them.  They are individually sealed and fresh, plus I ordered with Amazon's product subscription, so there was no shipping fee, and by the time I am finished, a new box will ship to me (well not for a few months)!",positive,6,193,0.3023,positive,positive,neutral,de,POSITIVE
446412,B000FJKQHI,A2GXM8GCLEWZQ6,"Dianne Hay ""holyhay""",4,5,5,1202428800,whole grain oatmeal,once you try this oatmeal you will never eat the instant [wallpaper paste] types again!!! We eat it on a daily basis and have lowered our cholesterol considerly.,positive,3,1,-0.3348,negative,negative,neutral,de,POSITIVE
186354,B002LN1ME2,A3DQWFWINN3V5A,David A. Lessnau,18,22,5,1217376000,Excellent Source of Magnesium,"If you're taking a lot of calcium, you'll need additional magnesium. This Natural Calm powder is a very good source of that magnesium. My wife is taking calcium and was suffering from severe feet and leg cramps (especially at night). A little research pointed to magnesium to help with this. As with calcium, the citrate form is best for absorption and that's what this Natural Calm provides (magnesium citrate). After just a couple of days of use, the cramping seems to have disappeared. One additional benefit is that certain digestive end processes seem to have smoothed out, too.<br /><br />I've also tried a flavored version of this product (Natural Vitality - Natural Calm Rasp-Lemon, oz powder, 16 powder).  Unlike that version, this stuff is entirely odorless, and the only taste is a sense of tartness.  I much prefer this non-flavored version over the flavored version.<br /><br />The only problem I have with this product is that it would have been very nice if the bottle had included a little plastic teaspoon scoop for measuring the dosage.  That's pretty insignificant.  So, I still rate it at an Excellent five stars out of five.  Highly recommended.  Especially if you're taking calcium.",positive,37,218,0.9859,positive,negative,neutral,normal,POSITIVE
40078,B000VYD0MA,A2WHEZQRNMXYCR,"Igor ""Igor""",0,2,1,1334016000,Absolutely worst gopher trap ever,"I have caught a few dozens of gopher in my life with different but similar traps.<br />This one is absolutely the worst. If fist only in HUGE gopher burrows. The quality is bad. First time, I cut my hand twice trying to set it up (and I was going after my probably 100th gopher).<br />Save yourself some time and money.",negative,1,22,-0.2067,negative,negative,disgust,de,NEGATIVE
130864,B00491FPRE,A27NP8AFU3DIQN,DonBel,0,0,5,1345334400,Stock for Salmon Bisque,I smoked a large wild-caught sockeye salmon and wanted to make a bisque from the meat I smoked on the bones.  Most recipes I checked used chicken stock as a base.  I chose your clam stock and Bar Harbor lobster stock (50%/50%) instead and it was superb. Thank you!,positive,2,2,0.784,positive,positive,joy,normal,POSITIVE
276162,B005OU6UM8,A1EJMIZBZEOMX9,123456,0,1,1,1344211200,My dog had a severe allergic reaction,"I tried this for the first time. I was attracted to it because it claimed it was 99% digestable, and did not pose the choking/blockage hazard that rawhide does.<br /><br />My dog loved it - but it did not last long. He consumed it within 3 minutes. Then about 20-30 minutes later, we had a BIG PROBLEM. He went into a seizure - both of his rear legs locked up, he was flailing his front legs around trying to get back up, his heart was pounding, he was panting heavily, had his teeth clenched, he was heavily salivating, and he defacated. He finally started to act relaxed, and then his eyes lost all life - I thought I was watching my dog die in front of me.<br /><br />Luckily, this event subsided, and he went back to normal. About 30 minutes after the seizure, he had a full bowel movement. Later, he ate a regular dinner and had another regular bowel movement, so that told me it wasn't a blockage. He is only 3 yrs old and strong as an ox (85 lb Collie), I have my doubts that it could be epilepsy or a brain tumor. I think he had a severe allergic reaction to the kelp and chlorophyl contained in the snack, or possibly that particular bag was tainted somehow. The sell-by date was good. It was highly coincidental that this all happened so shortly after feeding him this snack. I threw the rest of the snacks away, and I will never buy them again.",negative,1,6,0.4311,positive,negative,fear,normal,MIXED
512710,B0009X63DG,ANLIV3LVIJPRC,"G. Greene ""greenegs""",0,0,5,1331510400,Picky eater finally satisfied,Wife's dog has been a notoriously picky eater.  Over the past 7 years we have seen her try one thing after another until this brand - she has been on it for about 1.5 years now and never grows tired of it.,positive,4,9,0.3412,positive,positive,neutral,normal,POSITIVE
479648,B000P5Y0WY,AS8SDWC5RE36K,S. Wong,0,0,5,1333324800,Fruit Gummy Candy,This was a gift for my daughter and her family. I know they enjoyed the fruit gummys and we will be buying again and again.,positive,4,10,0.7351,positive,positive,joy,de,POSITIVE
272933,B007PA33NY,AP1DB195FN3A,"Terrill Nicholls ""tjnick""",1,1,4,1268784000,Kick it up a notch,"We've had our Kuering machine for over a year now.  We love it.  However, we've had a problem finding BOLD coffee.  Emeril's is very tasty and bold.  While it's not our favorite, it is up there at the top.  Sign up for Amazon's club and save money and postage.  You'll enjoy a very good cup of coffee at a very reasonable price.",positive,7,300,0.9486,positive,positive,neutral,normal,POSITIVE
395124,B002AUF0Q2,A16VQMPQ6LJ62D,"Paul S. Lunsford ""Fat Guy""",1,20,2,1268352000,Gluten Free-Higher Sugars,"This product has 8 times the sugar the Quaker Oats Low Sugar brand (1gm for Quaker, /8grm's for GlutenFree) and does not taste as good.  I would recommend buying the Quaker Oats Low Sugar and not the GlutenFree brand.",negative,1,64,-0.4777,negative,negative,neutral,de,NEGATIVE
441601,B002BUM582,A194L34R3CQWMF,anne taylor,0,0,5,1280620800,Loved IT!!!,"Made these on a sister's vacation. Used Vanilla Vodka. Let them freeze overnite. They were the perfect slushy, sitting on the dock drink. My mom & sisters all loved them.  Unfortunately had purchased mine on clearance at TJ Maxx. When I went back they were sold out. Thrilled to find them on Amazon. Ordered a 4pack for an upcoming Stella & Dot Jewelry party. Sure my friends will love them. Easy to make & delicious",positive,1,3,0.9816,positive,positive,joy,normal,POSITIVE
16895,B001LGGH40,A3QD59N3M7O7KB,Xina143,1,1,2,1235606400,"Tastes pretty good, BUT....","We got this in the mail and were eager to try it.  I am a huge fan of Izze Sparkling Juice and figured this would be similar to that.  It was in regards to taste, however.....well, let me break it down.<br /><br />TASTE: I would give it a four!  It had a slight kick to it, that I love.  A little bit of a bitter taste, which my two older boys seemed to like as well.  In fact my 13 year old was bummed when I said we had finished the can.  My husband enjoyed it as well, though I don't see this replacing his daily Dr. Pepper anytime soon.<br /><br />BENEFIT: It is 100% all natural juice, and it has 100% of your DV of Vitamin C.  Certainly a bit better for you than your traditional soda, but it has just as many calories as a LARGER can of Dr. pepper!  So, i fyou are like me and have maybe one carbonated beverage a day, calorie wise you aren't doing yourself any favors by switching to this.  I will stick with my Izze Blackberry.  3 stars.<br /><br />VALUE: 1 1/2 stars, MAYBE 2.  You get 24 8 oz cans for 23 dollars.  Hardly a bargain in today's economic climate.  I like to treat myself occasionally, and a sweet treat is certainly one way I often do that, but 23 dollars for 24 cans of this!  Nope, no way, not happening.<br /><br />Bottom line:  It was tasty, and we enjoyed it, but this isn't something I can see myself buying for my large family.  The benefits just aren't there, not when I can get 100% real fruit juice at the store for 3 dollars a gallon, and add a bit of soda water myself for another buck, if that.  Save your money",negative,10,341,0.996,positive,negative,sadness,normal,POSITIVE
