Id,ProductId,UserId,ProfileName,HelpfulnessNumerator,HelpfulnessDenominator,Score,Time,Summary,Text,Sentiment,user_review_count,product_review_count,vader_score,vader_sentiment,bert_sentiment,emotion,sarcasm,comprehend_sentiment
469319,B001E5E24A,A3FWRR4WGC2U93,"L. S. Pray ""Blonde, little old lady""",1,1,5,1311552000,The best you can buy,"My son adores Medaglia D'Oro Espresso and he drank all 6 jars in less than one month.  I did use some in my pumpernickle bread (it turned out very tasty) and I tried this myself.  I must admit that sonny loves his espresso so thick and rich from hanging around real Italians when he was little.  He loves the ""kick"" he gets from waking up with a cup of steaming hot strong espresso.  He turns his nose up at everything else.  Much better than Starbucks he says.  He has turned into an espresso afficiando it seems. He likes his black with no sugar or cream.  Me, I doctor mine up with sugar and cream and love it on the weak side.<br /><br />I sure hope they bring this back at the lower price it was when I bought the 6 pack as I will definitely stock up!!!!",positive,6,49,0.9839,positive,positive,neutral,normal,POSITIVE
395035,B004LCCGZK,A1JQQKOH437MEC,Nancy75,1,1,1,1339372800,Just horrible,"My family is on a reduced sugar diet to try to balance digestive flora, so finding a low carb syrup without artificial sweeteners was important.  This is literally the worst tasting ""food"" I have put in my mouth in a couple of years.  My kids literally started crying when they tried it.  I can't explain the good reviews.  We also ordered the Nature's Hollow line, and that has gone over very well with all of us. Stay away from this one.",negative,3,6,-0.8306,negative,negative,disgust,de,NEGATIVE
194126,B0009X0R38,A3LYBC0HXF7S7F,S. MARTINEZ,0,0,3,1296432000,cat food,This cat food ingredient list had high quality products. The only problem I have with it is that kibbles fall apart very easy. Just pouring it into their bowls made it disintegrate into dust. I kid you not. I'm thinking of moving over to Blue Buffalo.,neutral,1,10,0.1263,positive,negative,neutral,de,MIXED
469479,B000GG1O9O,A8UM78SMPSHC0,Hervian Rose,0,0,4,1257206400,Really lemony without being too sour.,"We get it by ""subscription"" and it usually runs out before the next box comes.<br />It's a little bland and tends to be a ""sick day"" favorite.",positive,18,22,-0.0772,negative,negative,sadness,de,NEGATIVE
90011,B0046GRD0O,A3POAWC2JPQQQP,me,3,3,5,1340236800,great with medjool dates!,"I love opening up a medjool date and lathering in some cacao bliss... DELICIOUS! Dabbing it on strawberries also makes a great dessert. It definitely has a thick consistency that's rich, maybe a little too rich for some people (after all there is a lot of coconut oil in it).",positive,49,19,0.9805,positive,positive,joy,de,POSITIVE
163425,B000A0VOD2,A3M8R4JD1SIS76,"'MaryLou Cheatham ""The Collard Patch""",6,7,5,1213401600,Defying Peter Rabbit,"We have been adding edible flowers and other vegetables to The Collard Patch lately.  The rabbits ate our eggplants, beets, tomatoes, carrots, sunflowers, and okra!  They skipped over the collards, garlic, and romaine.  All that work!  It seems the rabbits could at least wait  until the crops are grown so they would have more to eat.<br /><br />Then we discovered <a href=""http://www.amazon.com/gp/product/B000A0VOD2"">Deer Off DF32RTU Deer, Rabbit and Squirrel Repellent Ready-to-Use Spray 32 oz.</a> and stopped those boy and girl rabbits from eating.  Now they can spend their time elsewhere.  Maybe if they don't get so fat, they'll enjoy some of the other things that rabbits are known for, such as teasing dogs.<br /><br />So far this product is working.  It uses the flavors of rotten eggs, capsaicin, and garlic to repulse the rabbits, who are  . . . believe it or not . . . picky eaters.  This concoction is supposed to be weather-resistant.  So far with our frequent rains in Louisiana, it is still working.  When we get new leaves, we add more spray.  It  is supposed to last three months, and we are supposed to stop using it two weeks before harvesting.",positive,98,23,-0.8234,negative,negative,neutral,de,POSITIVE
289366,B000CMH0N6,A1S43C5E45XQN,"B. Rahn ""Mrs. Rahn""",0,0,5,1179273600,Very good teas,I have used Yogi teas for years and have never had a bad experience with them yet.  These teas really work.  Highly recommend them.,positive,3,11,0.7584,positive,positive,joy,de,POSITIVE
397052,B004T0DLHG,A2JQ3SEXKF86TF,"LeeAnn Voisinet ""L. Voisinet""",0,0,5,1331942400,Excellent Flavor,"This pepper adds that wonderful ""Chinese"" warmth to my stir fry dishes.  It was what I was missing.  I put them in a small pepper grinder and set it to a fine grind.  Works wonders.",positive,12,2,0.743,positive,positive,neutral,normal,POSITIVE
277828,B0055ZB0KO,ALUQSMPW5HU0E,Athena,1,1,5,1340582400,Love these sprouts,"I forgot how much I love sprouts in my salads and on my sandwhiches. These sprout quickly and are tasty.  Affordable, fast, and easy - my favorite combo.  Will order again :)",positive,1,10,0.9201,positive,positive,surprise,de,POSITIVE
209010,B00004RAMY,A9Z7AY40CUOMX,Archie,0,0,5,1325980800,Mole trap by Victor,I wrote a review before and will say they're great - you'll have to read directions and once you get the hang of it look out moles! I did have to put an empty buckrt with a rock on top so the pets wouldn't get hurt.Thank you.,positive,1,172,0.6588,positive,positive,neutral,de,POSITIVE
15544,B000255OIG,A5YACGTYAZKAL,M. Haagenstad,0,0,5,1194134400,UNBELIEVABLE PRICE!,"These freeze dried treats are our dogs favorite treats.  We've been spending DOUBLE the price I paid for them at local area pet stores (ie, Chuck & Don's and PetSmart).  Arrived promptly, well packaged.  Highly recommended.",positive,9,170,0.7501,positive,positive,joy,de,POSITIVE
88011,B0029NH0FE,A38WPLBU8HE5LT,Linnnie13,2,2,5,1268524800,My dogs love these!,I have two Westies and a Maltese. We tried many brands of canned food that they didn't like before we found Cesar's.  All three love this flavor!,positive,12,8,0.5239,positive,positive,neutral,normal,POSITIVE
139775,B001BCXTGS,A2XCSJZFSRDM4T,Sherrie Moran,1,1,4,1332115200,Good product for a good price and my cat likes it.,"Once my cat, Starlight, ate Petite Cuisine she was hooked. I was pleased to get the subscription price as it is significantly less than anyplace else and I never run out. When one order got lost in the mail, they overnighted a new shipment at no additional cost.",positive,5,229,-0.1531,negative,positive,joy,normal,POSITIVE
258053,B0041HSOQ0,A3V8I1LLLW5AZ3,Boulevard57,0,0,5,1344729600,Popcorners-Kettle Style,"The product is light and delicious like popcorn kettle corn, but crispy and crunchy like a chip. The only problem I had was that there was one bag missing from the shipment. The shipper was United Parcel Service (UPS), and I don't know whether the error occurred during shipment or packing.",positive,1,11,0.0387,neutral,negative,neutral,de,MIXED
533165,B001FKBYA4,A2P0X1P5HI312Q,HYTRIN5,0,0,3,1347753600,my dogs like them but I don't,"Dogs like them fine but the biscuits are just loose in the box.Bottom box seam not taped completely so dog biscuit ""dust"" falls out and is possible path for vermin. I would prefer if there was a liner or inner bag. If you buy these plan on storing them in a different container",neutral,1,1,-0.2023,negative,negative,neutral,de,MIXED
331339,B001P74NXM,AA6176V2HKG16,"Scott Turner ""EngineerBoy""",1,1,5,1289260800,"Great stuff, I use it for a simple syrup for sweetening iced tea","I love sweet iced tea, but don't necessarily like the glycemic load of sugar.  I've tried virtually all artificial and low/no-calorie sweeteners, and they either taste horrible or give me gastric distress.<br /><br />My wife also loves iced tea, but not as sweet as I do, so we came up with a system for sweetening on demand.  As any of you iced tea aficionados out there probably know, normal granulated table sugar will not dissolve in cold tea, and it's easiest to sweeten the tea when it's hot just after brewing, but then the sweetness level is set for that batch.<br /><br />So, what we do is create a simple syrup consisting of 1 part organic evaporated cane juice sugar, 3 parts of this organic raw agave syrup, and 2 parts hot water.  We put those in a <a href=""http://www.amazon.com/gp/product/B001NCDE52"">NALGENE Tritan 1-Quart Narrow Mouth BPA-Free Water Bottle</a>, shake it up for a minute, and voila, a very sweet liquid that we store in the fridge next to the tea.  Then, when we pour a glass of tea we splash some of the syrup in it to taste, and it mixes up nicely even in the cold tea.<br /><br />And the taste of this agave sweetener is excellent.  It is not exactly like table sugar, it has a hint of a molasses or dark brown sugar flavor, but only a hint, and nothing 'artificial' or 'aftertaste'-y.<br /><br />And, yes, I know this is still sugar with empty calories, but I try to use it in moderation and figure that the lower glycemic load of agave is better than full-on refined table sugar, and the fact that both ingredients are organic make me feel better about it as well.",positive,11,169,0.9825,positive,negative,fear,normal,MIXED
566606,B0000D9MY0,A3CWYG8LC9JZ0I,Jennifer Petersen,3,3,3,1291075200,Ok,Not a single outstanding cheese. Could have just gone to the store. Generic and bland. Even the Gouda was unremarkable.,neutral,1,1,-0.4973,negative,negative,disgust,de,NEGATIVE
380121,B002YR79ME,A35BE6WQW5X420,"Juan Paniagua ""BrokerJuan-Realtor""",0,0,5,1334102400,Fast delivery and great packaging!,"Super fast delivery! And amazing packaging! When i opened the box i saw 18 Cob's as promised and i took the first 1 out to try it, and it tasted GREAT! I love these things and i will definitely keep buying from here when i need more! =D REMEMBER TO HEAT THEM UP FOR 10 SECONDS!",positive,1,16,0.9825,positive,positive,joy,de,POSITIVE
85142,B004TI4SIE,A1ZPRJWAVMCBVC,indore,2,2,4,1339632000,STRONG BUT SWEET,a very strong authentic ginger taste. much denser then ginger teas. only issue for me is that it contains too much sugar.,positive,3,65,0.5984,positive,positive,joy,de,MIXED
560495,B000CQID1K,A2SJ4VQ7H3FFS5,REITdude,0,0,4,1195084800,Better than regular Slim Jim's,"If you like regular Slim Jim's, then you should like the Nacho flavor.  Similar to most of my food reviews, these are great for a low-carb diet.  For low-carbers the only problem is the HEFTY dose of sodium, so drink lotsa water with these.",positive,11,193,0.7506,positive,positive,neutral,de,MIXED
383256,B003G0APGK,AH2NM0XRJ40TC,A. Guilbault,1,1,4,1313020800,Wellness Makes Good Cat Food,Most of my cats really like this Wellness Turkey and Duck flavor food. I wish the sauce was a little thicker like the other varieties. Wellness makes high quality pet foods with great ingredients that are good for our pets.,positive,23,33,0.9653,positive,positive,neutral,de,POSITIVE
84424,B000ETAJZ8,AHX1VRNLDFT5Y,Stephen A. Kaelin,0,0,5,1272672000,great substitute,I try to find different snacks for my girlfriend who is gluten intolerant. She really likes these and I have had a few myself and think they taste pretty good too!,positive,7,80,0.8585,positive,positive,joy,de,POSITIVE
306117,B001UR5ARU,A2WQ0JLVVN4YHZ,Evangelist Spankie,0,0,5,1343001600,Sassy loves these,My shih tzu Sassy love these breath freshening treats she gets one about every three days and she thinks it's candy and her breath does not smell like dog!!!!!!!!!!!!,positive,1,2,0.6437,positive,positive,neutral,de,POSITIVE
542274,B0030GQHXA,AMIJCZY78FDYX,"W. Applegren ""mom of 2""",0,0,5,1266278400,Love this non-coffee option for my Keurig brewer!,"This is my new favorite!  It's a little pricey but way less than you'd pay at a coffee shop.  It is creamy, sweet Chai tea latte- but the sugar count is low so just what my diabetic spouse can have as a sweet treat.  I love them too, had to reorder 3 boxes at a time because we went through the first box so fast!  Be careful not to use the largest cup setting though, unless you want your latte to be more diluted.",positive,1,93,0.9675,positive,positive,neutral,normal,POSITIVE
490722,B002HFWNAQ,AWFUPO7MG0RXZ,John Crow,2,4,1,1258156800,Rich Chocolate Mix,The taste of this product in my opinion is NASTY to say the least.<br /><br />Nestle's should bring back the recently discontinued (Milk Chocolate) flavor 50000 11164<br /><br />Nestle's you BLEW IT by dropping the Milk Chocolate flavor.<br /><br />Not everyone likes coffee or hot chocolate that is so thick or taste like MUD!!!,negative,11,112,-0.722,negative,negative,disgust,de,NEGATIVE
259269,B003SPIM1S,A1SFR88YZNLAZM,"Yao Jin ""Tech Enthusiast""",3,3,2,1346025600,"Great taste, horrible price","Taro is a purple potato that has a very subtle taste normally.  When it's combined with a creamy and sweet flavor, its taste gets enhanced substantially to get something very unique and pleasant.<br /><br />This is the typical brand carried at many Asian markets.  Except, most Asian markets sell them for $2.00, $3.00 at most.  $10.00 is highway robbery.<br /><br />Bottom line: taste alone, this gets 5 stars.  At $10.00, rating drops down to 2 stars.",negative,2,1,0.25,positive,positive,neutral,de,MIXED
451405,B003QDRJXY,A2KX9W1FOFAZ0,"Pro-Evo ""Dave""",1,1,5,1326499200,Saturated Fat - Hooray!,"I love this stuff - use it in everything. I notice a number of reviewers here saying, ""even though it's saturated, it has medium chain fatty acids that are easily converted...etc. etc."" Folks, the idea that saturated fat is dangerous is the biggest scientific fallacy of the 20th century. Read ""Good Calories, Bad Calories"" or any other work on diet by Gary Taubes. Natural saturated fats (NOT trans-fats) of all kinds, including from pasture-raised animals, are very good for you. And this one is absolutely delicious!",positive,6,264,0.9213,positive,positive,neutral,de,POSITIVE
347354,B001E5DZH0,A3W28MFB5ZF9PP,Patricia Heinze,0,0,3,1290124800,Perfect Textured Laces,"I love laces and these were very fresh with great texture.  The dissapointment I had was the flavor.  They were very artificial strawberry flavored.  I think I like cherry much better.  If you like strawberry candy, you will love these!",neutral,1,20,0.9737,positive,positive,joy,de,MIXED
166036,B002O039JI,A2DN2XJB5RYHYB,Jane,0,0,5,1337731200,My husband's must have every morning,"My husband likes this flavor - we found a new travel mug from Starbucks it is exactly 8 oz, perfect size for most Dolce Gusto coffee, he loves the mug!<br /><br />Ok, back to the review of the coffee, he is a black coffee drinker, we tried most of the flavor, this one is strong, but not too strong, he seems like it very much.",positive,2,23,0.7743,positive,positive,neutral,de,POSITIVE
235054,B0034EDMCW,A2ZY4FJBKAI0CE,mydonda,0,0,4,1345852800,really good,My husband takes a Kind bar with him to work everyday. He eats it for his afternoon snack. That way he's not hungry until dinner.,positive,5,330,0.5267,positive,positive,neutral,de,POSITIVE
334878,B000EDGB2E,A11LWA17XHHZ1B,Randy Cassingham,0,0,5,1248739200,Best of the Crunchies Fruits,"I've tried all of the Crunchies fruits, and these are even better than the strawberries -- which is what attracted me to the brand in the first place. No negatives (even the price is decent), though I'd love to see more fruits in their line-up, such as pears and peaches -- and citrus if they come out well from the process. Highly recommended.",positive,6,67,0.8977,positive,positive,joy,de,POSITIVE
321727,B0053WMOKY,A3PTV7JYEYOYXJ,Lacy Bee,0,0,5,1338336000,Fantastic!  Roscoe Loves it!,"Our 1 year old boxer/pit-bull ""pup"" loves his antler! He is 70 lbs, and has a big old head with an alligator-like mouth.  Despite the fact he gets a lot of daily exercise, he still has plenty of energy and loves to chew in his spare time.  I ordered him the 10"" size, which is perfect.  There is no odor, does not leave any mess, and has provided him hours of chewing fun already.  He prances around with it in his mouth, and prefers it to his other chew toys.  Would recommend this item to anyone with a dog who has big, strong chompers and loves to chew.  He has a synthetic nylabone which is said to be okay for dogs to ingest, but I am still leery about the shards that break off due to his gnawing, and also the rough edges that are created.  This antler is dense does not seem to splinter into pieces, and as it is all natural, I do not have any worries about him eating any pieces that my break off due to chewing. I plan to order another one for him, as well as a smaller one for his boxer cousin.",positive,1,25,0.9755,positive,positive,neutral,normal,POSITIVE
310233,B000S11DKC,A4XMX561LISFA,C. Matthews,0,0,5,1267660800,A welcome change from yellow cornmeal.,"We are using this blue cornmeal for cornbread and it is very delicious. It has kind of a nutty taste and a more substantial texture than yellow or white cornmeal-based cornbread. After eating the standard cornbread for years we are delighted with the change. We now alternate between them for variety. Since we ordered 10 pounds, as soon as the blue cornmeal arrived we put it in a plastic bag and stored it in the freezer.",positive,2,1,0.855,positive,positive,joy,normal,POSITIVE
328551,B004RZZM4S,A1OHITJZJSENCZ,"Mad Mal ""The Malster""",0,2,1,1333584000,Idiots!,"Sent wrong product. I ordered Ham and Bean soup, and they sent Chili Beans. Horrible experience.  Now, I suppose the burden is on me. They should send me a new box of the CORRECT product.",negative,1,4,-0.8591,negative,negative,disgust,de,NEGATIVE
470456,B001D9ZV5G,A4QXRLFVZN03N,Sara Hardigan,13,13,5,1165017600,LOVE IT,"I have an eldery dog with hip and joint problems. We have been using Zuke's for a little more than a month and have seen and amazing improvements in her. She loves the way the treats taste and goes crazy at the sight of the bag. She can now navigate stairs, is more interested in play and she even runs on daily walks all because of Zuke's!",positive,15,98,0.8921,positive,positive,surprise,normal,POSITIVE
400004,B002IEVJRY,A2IMLOJ2Z2QEU2,Naomi (Storm),0,0,4,1333584000,I really enjoyed it - not a major coffee drinker,"I am not a huge coffee fan - I prefer my coffee in a dessert style: creamy and sweet. The Starbucks mocha Frapachinos (bottled) are usually the only coffee-esque drink that I like, and even those I only drink a few times a year. The illy issimo Cappuccino wasn't bad - it wasn't nearly as creamy as the Starbucks drinks, but it was also around a half of the calories, so there's a bit of give and take there. It's also not super sweet - many of the Starbucks drinks border on that thin line between really tasty and ""The sugar is melting my teeth"". The illy issimo is very safely stashed on the not-super-sweet side of the fence. Don't take that to mean there isn't any sweetness - I'd compare it to a Symphony chocolate bar versus a Hershey's milk chocolate bar. They both have very similar flavor profiles, but the generic Hershey bar is so much sweeter. I can't really say it's like a dark chocolate either, because the cappuccino didn't have a lot of the bitter undertones that the dark chocolates and espresso drinks tend to have.<br /><br />As for energy burst, I should preface by saying that I'm not much of a caffeine drinker any more. My normal drink is straight water, and at restaurants iced tea (unsweet). I think my body has stored up reserves of caffeine and sugar from my childhood days though - back when I drank a six-pack (or more) of Coke a day. That being said, the ""rush"" from the drink took a few hours for me to feel it (granted I had already eaten lunch and had a full stomach, which might explain the lag). But when it hit, it was a sort of ""giddy"" high, not like a super pixie-stick rush. I also can't say I experienced much of a telltale caffeine crash either, the extra energy just quietly bled away.<br /><br />All-in-all, should I decide to pick up a coffee drink, I wouldn't hesitate to get another one from illy issimo.",positive,19,488,-0.834,negative,negative,neutral,de,MIXED
348765,B005IYFRUQ,A9X63F97G1542,normacarr,1,1,5,1344988800,EZ-CUP,"<a href=""http://www.amazon.com/gp/product/B002YPC2NM"">EZ-Cup for Keurig Coffee Machines By Perfect Pod</a>Saves lots of money when you use this cup instead of Kurig  and you can use your favorite brand of coffee.",positive,1,10,0.7717,positive,negative,neutral,normal,POSITIVE
566385,B004R8L71W,A307YFSORUAXSQ,NYCPickyMom,1,1,4,1312848000,good,"I could smell the green vegetable flavor while cooking the macaroni but after adding the cheese packet, butter, milk and a sprinkle of cheddar you couldnt tell it was in there at all. The flavor was the same as the regular but the texture was slightly off. My kids ate it but it bothered me that my dog wouldnt touch it. She always gets the leftover Kraft mac & cheese but this she just smelled. I wouldnt buy this again. I much prefer using the regular mac and cheese and adding veggies to the water while cooking such as broccoli, carrots or peppers.",positive,10,102,-0.4497,negative,negative,disgust,normal,NEGATIVE
497280,B004E4EBMG,A9XX8OHS2ZQ2X,R. Neil Scott,0,0,3,1328918400,Like the taste ... not the packaging,When I first received my MIO Mango Peach through the Amazon Vine program I was excited to try it. I am a huge fan of anything peach so I knew I would like the flavor. As expected the taste was really great added to a glass of water. What I didn't like was I found it very hard to squeeze the flavoring out of the bottle and to know how much I should squirt into the glass. The directions tell you how many teaspoons a serving is but if you try to squirt it into a spoon to measure it you just get a big mess. I wouldn't say this is a bad product but it's not something I will run out and purchase.,neutral,7,274,-0.432,negative,negative,disgust,de,MIXED
424515,B002HFPW6I,A29JOWXLD1GBKK,"Cynthia Raymond ""cinray""",0,0,4,1286668800,"Trio bars bby Mrs, May...","I really like these nut filled health bars.  In the past I could only find them at my local wearhouse store so I went looking on line.  As usual, Amazon came to my rescue.  These bars are smaller than the wearhouse bars but not too much. The were at my door quickly and in good shape.",positive,1,143,0.8045,positive,positive,joy,normal,POSITIVE
331212,B0007V2WZI,A5B3Z1BPLTTZ0,B. Olson,2,2,5,1206230400,Yummy Spicy!,"Reminds me of when I used to live in Thailand, great flavor, easy to make, I always add an egg.",positive,3,3,0.7906,positive,positive,neutral,de,POSITIVE
340029,B000EYPNCW,A3FWB7PP53FEHM,D. Schasteen,4,5,4,1171756800,NOT SALTY,"I don't normally review items, but I had to write something on this because all of these ""it's too salty"" comments are driving me crazy. These are hardly salty at all.<br /><br />There is far more salt in potatoe chips or popcorn or basically any other snack food. My bag says its only 8% of your daily sodium, which is much lower than you would think from the comments people are leaving. I'm a man, so I personally think these could use MORE salt.",positive,1,30,-0.7096,negative,negative,neutral,de,NEGATIVE
55830,B000EZSFVW,AZ4559S8F5J4F,Guy Stewart,0,0,5,1178323200,Great Jerky,"This jerky is fantastic.  I'm somewhat of a jerky fanatic, and I've tried many kinds of jerky.  This one is awesome and you wouldn't know it was Turkey if you ate it and no one told you.  Highly recommended...",positive,17,8,0.8221,positive,positive,joy,de,POSITIVE
23227,B000EG1RF2,A3OF5X8WQ5N5HQ,Shelly R. Sharbono,1,2,5,1207353600,Great candy,This candy is great.  The cost of the freight to Montana is to high.  It was more than the candy.,positive,1,3,0.6249,positive,positive,joy,de,POSITIVE
490321,B001E5DZJ8,A334K3EPD2H467,Sarah Norman,0,0,5,1314662400,Tastes great,These taste great.  I add 1 or 2 cubes to the water when cooking quinoa or lentils and it really adds a nice depth of flavor.  I use them often.,positive,1,20,0.8,positive,positive,joy,de,POSITIVE
211541,B003P00O3K,A2GT6KYRL1EMF9,Joycelyn,3,3,5,1286928000,Sparkling water,"Perfect.  Just a touch of lime/lemon taste - all that is needed.  The ""sparkle"" is also just right.  Goes down easily and is more enjoyable than basic water.",positive,1,9,0.902,positive,positive,joy,normal,POSITIVE
133052,B0090X8IPM,A2CT2SA6KFE8GC,"Stanley Runk ""Runkdapunk""",1,1,2,1294099200,Nah.,"You know, I have to say I wasn't impressed much by this stuff.  I'd like to say otherwise, but I'd might as well be honest.  Taste wise it was so-so, but the real zinger was a nasty aftertaste.  I'm not crazy, my wife experienced this too.  Sure, individual coffee makers can alter taste, but since everything else is fine going through ours, my money's on the coffee itself.  Sorry.",negative,20,530,0.9114,positive,negative,disgust,de,MIXED
382259,B0060HVNNA,A2CNC296HOUVFU,Michael S. Talisman,9,12,1,1303171200,Horrible!,"I bought two 17.6 oz cans.  Both are marked with 12/2010 packing date and 12/2012 expiration date.  This coffee is absolutely bland, nothing like Effendi I have had before this order, from a different vendor.  Either it was stale before it was canned or there might be another possible explanation.  The text on either can is in Turkish and German.  The same brand bought before, from a different vendor, was in Turkish and English.  Perhaps, for German market, it is supposed to be bland but I doubt it.  The largest Turkish community outside of Turkey would not drink this stuff.<br /><br />I got full refund from Amazon.<br /><br />I strongly recommend to buy your Mehmet Effendi from another vendor and to make sure the text on the can is in Turkish and English.",negative,3,24,0.6011,positive,negative,neutral,de,NEGATIVE
